{
  "$schema": "../schema/scheme.schema.json",
  "id": "coen-wide-zone-rpo",
  "name": "Liam Coen's Hybrid Wide-Zone RPO System",
  "coachId": "liam-coen",
  "team": "Jacksonville Jaguars",
  "side": "offense",
  "era": "modern-nfl",
  "lineage": "shanahan-kubiak",
  "description": "The modern evolution of the Shanahan-McVay tree: Liam Coen packages genuine wide-zone run mechanics directly with post-snap RPOs, turning every zone-stretch call into a triple-option math problem for the defense. Glance shots off box-number reads, three-level bubble-slant-flat triangles, cross-field crack tosses, and orbit-motion cutbacks all grow from the same identical run picture — the defense can never be right against both halves of any call."
}
