{
  "$schema": "../schema/scheme.schema.json",
  "id": "mcvay-duo-playaction",
  "name": "Sean McVay's Condensed Duo & Play-Action Attack",
  "coachId": "sean-mcvay",
  "team": "Los Angeles Rams",
  "side": "offense",
  "era": "modern-nfl",
  "lineage": "shanahan-kubiak",
  "description": "Sean McVay's championship offensive system engineered around condensed 11-personnel formations with tight receiver splits. By pairing physical 'Power without a puller' Duo double-teams with identical play-action 3-level Sail floods, explosive deep crossing over-routes, and rapid Glance RPOs, McVay keeps defensive front sevens in permanent schematic conflict."
}
