{
  "$schema": "../schema/scheme.schema.json",
  "id": "coryell-vertical",
  "name": "Don Coryell's Air Coryell Vertical Family",
  "coachId": "don-coryell",
  "team": "San Diego Chargers (1978-86)",
  "side": "offense",
  "era": "past-nfl",
  "lineage": "coryell-vertical",
  "description": "The original vertical passing tree. Coryell stretched defenses with five-step drops, seam-post strokes, and layered deep crossers, forcing single-high safeties to defend the whole field while tight ends occupied the middle hole. Every modern timing-based passing game descends from these four calls."
}
