{
  "$schema": "../schema/scheme.schema.json",
  "id": "saleh-43-wide9",
  "name": "Robert Saleh's 4-3 Wide-9 & Cover 3 Match",
  "coachId": "robert-saleh",
  "team": "San Francisco 49ers / NY Jets",
  "side": "defense",
  "era": "modern-nfl",
  "lineage": "carroll-saleh-wide9",
  "description": "A masterclass in modern defensive front geometry and disciplined coverage matching. Built around aggressive Wide-9 defensive end splits and penetrating 3-techniques that generate elite 4-man pressure, complemented by pattern-matching Cover 3 Rip/Liz, split-field Cover 6 brackets, and timed A-gap cross-dog blitzes."
}
