{
  "$schema": "../schema/scheme.schema.json",
  "id": "reid-spread-rpo",
  "name": "Andy Reid's Spread-RPO & Mesh Passing Family",
  "coachId": "andy-reid",
  "team": "Kansas City Chiefs",
  "side": "offense",
  "era": "modern-nfl",
  "lineage": "reid-west-coast",
  "description": "The pinnacle of modern hybrid football. Andy Reid synthesizes classic West Coast horizontal passing and timed rhythm with modern spread RPO tags, Mesh shallow crossing rub combinations, misdirection power shovel passes, and perimeter sprintout smash-wheel concepts. Operating out of 11-personnel Gun Trips alignments, Reid stresses second-level conflict defenders with identical pre-snap looks before unleashing lethal horizontal and vertical route combinations."
}
