{
  "$schema": "../schema/scheme.schema.json",
  "id": "macdonald-hybrid-disguise",
  "name": "Mike Macdonald's Hybrid Disguise & Sim Pressures",
  "coachId": "mike-macdonald",
  "team": "Baltimore Ravens / Seattle Seahawks",
  "side": "defense",
  "era": "modern-nfl",
  "lineage": "macdonald-pressure",
  "description": "The cutting edge of NFL defensive design. Built on pre-snap ambiguity, Amoeba and Double-A mug presentations, 4-man simulated pressures (Creepers) that drop interior linemen into passing windows, post-snap safety spins into corner traps, and lethal 6-man Cover 0 peel blitzes that force quarterbacks into impossible post-snap calculations."
}
