{
  "$schema": "../schema/scheme.schema.json",
  "id": "mcdaniel-cheat-motion",
  "name": "Mike McDaniel's Speed Cheat-Motion & Space Attack",
  "coachId": "mike-mcdaniel",
  "team": "Los Angeles Chargers",
  "side": "offense",
  "era": "modern-nfl",
  "lineage": "shanahan-kubiak",
  "description": "Mike McDaniel's revolutionary speed-in-space scheme that weaponizes pre-snap 'Cheat Motion' (sprint-speed motion at the snap). By giving explosive playmakers a running start to crack edge defenders on perimeter tosses, feigning cracks on devastating sideline wheel shots, punishing overpursuit with inside zone Wham traps, and running pistol speed options in the red zone, McDaniel creates mathematical dilemmas for any defense."
}
