{
  "$schema": "../schema/scheme.schema.json",
  "id": "cover2-man-under",
  "name": "Marvin Lewis' Cover 2 Man-Under",
  "coachId": "marvin-lewis",
  "team": "Baltimore Ravens DC (1996-2001)",
  "side": "defense",
  "era": "past-nfl",
  "lineage": "two-deep-shell",
  "description": "The red-zone answer of Lewis' Baltimore defenses: two safeties splitting the deep halves at full depth while five defenders play straight man underneath. Press-trail corner leverage turns every compressed release and every fade attempt into a contested footrace, with the deep halves standing as pure insurance behind the trails. When the structure needs teeth, a walked safety converts it into max pressure with one man swallowing the entire deep zone."
}
